{
  "schema_version": "1.0.0",
  "artifact_id": "ny.osc.owner_name_file.third_bounded_attempt_authorization_proposal",
  "artifact_version": "1.0.0",
  "prepared_on": "2026-09-18",
  "status": "PROPOSED_NOT_AUTHORIZED",
  "source_id": "ny.osc.unclaimed_funds.owner_name_file",
  "request_scope": {
    "repository_only": true,
    "source_network_access_performed": false,
    "download_performed": false,
    "owner_file_opened": false,
    "owner_pii_processed": false
  },
  "preceding_attempt": {
    "attempt_number": 2,
    "execution_result_path": "sources/evidence/ny_osc_owner_name_file_second_attempt_execution_result.v1.json",
    "status": "BLOCKED_FAIL_CLOSED",
    "reason_code": "UNEXPECTED_DATA_FIELD_COUNT",
    "transient_local_approval_consumed": true,
    "transient_pii_approval_consumed": true,
    "approvals_reusable": false,
    "retry_authorized": false,
    "raw_file_logically_deleted": true,
    "physical_secure_erasure_guaranteed": false,
    "owner_values_returned": false
  },
  "verified_offline_remediation": {
    "integrated_branch": "mvp1-ny-second-attempt-approved-ready-execution",
    "integrated_merge_checkpoint": "85d5f0c1101e5d66add27b9e1f445e7bba54a3b0",
    "repair_head_checkpoint": "fc6f159d4569989aeaa57028089de0c0b32f2f41",
    "pull_request_number": 2,
    "verification_ci_run_id": 35381899112,
    "verification_ci_conclusion": "SUCCESS",
    "verification_jobs": [
      "quality",
      "streamlit-candidate"
    ],
    "real_owner_file_used_for_remediation": false,
    "changes": [
      "split pipe-delimited records without treating pipes inside double quotes as structural delimiters",
      "preserve doubled double quotes while scanning at byte level",
      "fail closed on an unclosed quoted record",
      "retain only authorized non-PII structural diagnostics on blocked outcomes",
      "reject consumed second-attempt approvals before creating a download directory or prompting for a download"
    ]
  },
  "fresh_preflight": {
    "required_immediately_before_execution": true,
    "performed_for_this_proposal": false,
    "remote_access_authorized_by_this_proposal": false,
    "historical_listing_for_comparison_only": {
      "remote_listing_name": "FINDERS.zip",
      "size_display": "390.51 MB",
      "last_modified_display": "9/16/2026, 1:33:31 PM",
      "evidence_path": "sources/evidence/ny_osc_owner_name_file_current_listing_metadata.v1.json"
    },
    "required_result": "EXACT_MATCH_OR_STOP",
    "drift_behavior": "STOP_BEFORE_DOWNLOAD_AND_REFRESH_PROPOSAL"
  },
  "proposed_execution_bounds": {
    "attempt_number": 3,
    "downloads_max": 1,
    "retries_max": 0,
    "max_download_bytes": 450000000,
    "max_uncompressed_bytes": 2000000000,
    "max_archive_members": 1,
    "text_members_required_exactly": 1,
    "expected_delimiter": "|",
    "expected_documented_field_count": 14,
    "automatic_widening_allowed": false,
    "automatic_retry_allowed": false
  },
  "proposed_privacy_scope": {
    "transient_local_file_only": true,
    "durable_raw_persistence_allowed": false,
    "repository_persistence_allowed": false,
    "cloud_sync_allowed": false,
    "chat_upload_allowed": false,
    "immediate_logical_deletion_required": true,
    "transient_owner_pii_in_memory_allowed": true,
    "owner_rows_persistence_allowed": false,
    "owner_field_logging_allowed": false,
    "row_specific_human_inspection_allowed": false,
    "derived_non_pii_schema_metadata_persistence_allowed": true,
    "physical_secure_erasure_guaranteed": false
  },
  "required_human_authorizations": [
    {
      "gate": "HUMAN_NY_OSC_FIRST_DOWNLOAD_TRANSIENT_LOCAL_FILE_RETENTION_AUTHORIZATION",
      "approval_phrase": "APPROVO NY OSC THIRD TRANSIENT LOCAL FILE BOUNDED ONCE",
      "status": "NOT_GRANTED",
      "single_use": true,
      "reusable": false
    },
    {
      "gate": "HUMAN_NY_OSC_OWNER_NAME_FILE_FIRST_DOWNLOAD_TRANSIENT_PII_AUTHORIZATION",
      "approval_phrase": "APPROVO NY OSC OWNER NAME FILE THIRD BOUNDED TRANSIENT PII ATTEMPT ONCE",
      "status": "NOT_GRANTED",
      "single_use": true,
      "reusable": false
    }
  ],
  "implementation_gate": {
    "third_attempt_runner_status": "NOT_IMPLEMENTED",
    "third_attempt_approval_artifacts_status": "NOT_CREATED",
    "execution_status": "BLOCKED_PENDING_SEPARATE_HUMAN_AUTHORIZATION",
    "second_attempt_runner_reuse_allowed": false,
    "second_attempt_approval_reuse_allowed": false
  },
  "authorization_does_not_grant": {
    "source_network_access": false,
    "download": false,
    "source_activation": false,
    "production_classification_activation": false,
    "identity_resolution": false,
    "beneficiary_matching": false,
    "outreach": false,
    "fee_agreement": false,
    "representation": false,
    "claim_activity": false
  },
  "next_action": "HUMAN_REVIEW_NY_OSC_THIRD_BOUNDED_ATTEMPT_PROPOSAL"
}
